{
  "schema": "pikit.inputlog/v0",
  "rulesHash": "0xa7b58c23f4f9c3aaab3b14548363b4786e6604f336928b040844b5682626a1e0",
  "chainId": 143,
  "shop": "0x5b0b000000000000000000000000000000000005",
  "roomId": 5,
  "seed": "0x0101010101010101010101010101010101010101010101010101010101010101",
  "firstWindow": 40000,
  "lastWindow": 40300,
  "windows": [
    {
      "window": 40001,
      "blockHash": "0x5050505050505050505050505050505050505050505050505050505050505050",
      "inputs": [
        {
          "type": "purchase",
          "ref": "5000",
          "owner": "0x5c5c000000000000000000000000000000000001",
          "tiers": [
            0,
            1,
            2,
            0,
            1
          ]
        },
        {
          "type": "purchase",
          "ref": "5001",
          "owner": "0x5c5c000000000000000000000000000000000002",
          "tiers": [
            1,
            2,
            0,
            1,
            2
          ]
        },
        {
          "type": "purchase",
          "ref": "5002",
          "owner": "0x5c5c000000000000000000000000000000000003",
          "tiers": [
            2,
            0,
            1,
            2,
            0
          ]
        },
        {
          "type": "purchase",
          "ref": "5003",
          "owner": "0x5c5c000000000000000000000000000000000004",
          "tiers": [
            0,
            1,
            2,
            0,
            1
          ]
        }
      ]
    }
  ]
}
