{
  "schema": "pikit.inputlog/v0",
  "rulesHash": "0x3b2ebd7d60b5206e37b7d3abf9847cb4281742180bef08083ebf97aba290966a",
  "chainId": 143,
  "shop": "0x5b0b000000000000000000000000000000000005",
  "roomId": 6,
  "seed": "0x0101010101010101010101010101010101010101010101010101010101010101",
  "firstWindow": 50000,
  "lastWindow": 52000,
  "windows": [
    {
      "window": 50001,
      "blockHash": "0x6060606060606060606060606060606060606060606060606060606060606060",
      "inputs": [
        {
          "type": "purchase",
          "ref": "6000",
          "owner": "0x6e6e000000000000000000000000000000000001",
          "tiers": [
            0,
            1,
            2,
            0,
            1,
            2,
            0,
            1,
            2,
            0
          ]
        },
        {
          "type": "purchase",
          "ref": "6001",
          "owner": "0x6e6e000000000000000000000000000000000002",
          "tiers": [
            1,
            2,
            0,
            1,
            2,
            0,
            1,
            2,
            0,
            1
          ]
        },
        {
          "type": "purchase",
          "ref": "6002",
          "owner": "0x6e6e000000000000000000000000000000000003",
          "tiers": [
            2,
            0,
            1,
            2,
            0,
            1,
            2,
            0,
            1,
            2
          ]
        },
        {
          "type": "purchase",
          "ref": "6003",
          "owner": "0x6e6e000000000000000000000000000000000004",
          "tiers": [
            0,
            1,
            2,
            0,
            1,
            2,
            0,
            1,
            2,
            0
          ]
        },
        {
          "type": "purchase",
          "ref": "6004",
          "owner": "0x6e6e000000000000000000000000000000000005",
          "tiers": [
            1,
            2,
            0,
            1,
            2,
            0,
            1,
            2,
            0,
            1
          ]
        },
        {
          "type": "purchase",
          "ref": "6005",
          "owner": "0x6e6e000000000000000000000000000000000006",
          "tiers": [
            2,
            0,
            1,
            2,
            0,
            1,
            2,
            0,
            1,
            2
          ]
        }
      ]
    },
    {
      "window": 51000,
      "blockHash": "0x6161616161616161616161616161616161616161616161616161616161616161",
      "inputs": [
        {
          "type": "purchase",
          "ref": "6010",
          "owner": "0x6e6e000000000000000000000000000000000001",
          "tiers": [
            1,
            2,
            0,
            1,
            2,
            0,
            1,
            2,
            0,
            1
          ]
        },
        {
          "type": "purchase",
          "ref": "6011",
          "owner": "0x6e6e000000000000000000000000000000000002",
          "tiers": [
            2,
            0,
            1,
            2,
            0,
            1,
            2,
            0,
            1,
            2
          ]
        },
        {
          "type": "purchase",
          "ref": "6012",
          "owner": "0x6e6e000000000000000000000000000000000003",
          "tiers": [
            0,
            1,
            2,
            0,
            1,
            2,
            0,
            1,
            2,
            0
          ]
        },
        {
          "type": "purchase",
          "ref": "6013",
          "owner": "0x6e6e000000000000000000000000000000000004",
          "tiers": [
            1,
            2,
            0,
            1,
            2,
            0,
            1,
            2,
            0,
            1
          ]
        },
        {
          "type": "purchase",
          "ref": "6014",
          "owner": "0x6e6e000000000000000000000000000000000005",
          "tiers": [
            2,
            0,
            1,
            2,
            0,
            1,
            2,
            0,
            1,
            2
          ]
        },
        {
          "type": "purchase",
          "ref": "6015",
          "owner": "0x6e6e000000000000000000000000000000000006",
          "tiers": [
            0,
            1,
            2,
            0,
            1,
            2,
            0,
            1,
            2,
            0
          ]
        }
      ]
    }
  ]
}
