{
  "schema": "pikit.inputlog/v0",
  "rulesHash": "0x3b2ebd7d60b5206e37b7d3abf9847cb4281742180bef08083ebf97aba290966a",
  "chainId": 143,
  "shop": "0x5b0b000000000000000000000000000000000005",
  "roomId": 1,
  "seed": "0x4242424242424242424242424242424242424242424242424242424242424242",
  "firstWindow": 1000,
  "lastWindow": 1700,
  "windows": [
    {
      "window": 1001,
      "blockHash": "0x0101010101010101010101010101010101010101010101010101010101010101",
      "inputs": [
        {
          "type": "purchase",
          "ref": "8812",
          "owner": "0xa11ce00000000000000000000000000000000001",
          "tiers": [
            2,
            2,
            0
          ]
        }
      ]
    },
    {
      "window": 1002,
      "blockHash": "0x0202020202020202020202020202020202020202020202020202020202020202",
      "inputs": [
        {
          "type": "purchase",
          "ref": "8813",
          "owner": "0xb0b0000000000000000000000000000000000002",
          "tiers": [
            0
          ]
        }
      ]
    },
    {
      "window": 1040,
      "inputs": [
        {
          "type": "purchase",
          "ref": "8814",
          "owner": "0xb0b0000000000000000000000000000000000002",
          "tiers": [
            2,
            1
          ]
        }
      ]
    },
    {
      "window": 1041,
      "inputs": [
        {
          "type": "cancel",
          "owner": "0xb0b0000000000000000000000000000000000002",
          "itemKey": "8814:1"
        }
      ]
    },
    {
      "window": 1100,
      "inputs": [
        {
          "type": "purchase",
          "ref": "8815",
          "owner": "0xc0c0000000000000000000000000000000000003",
          "tiers": [
            0,
            0,
            0,
            0,
            0,
            0,
            0,
            0,
            0,
            0
          ]
        },
        {
          "type": "purchase",
          "ref": "8816",
          "owner": "0xc0c0000000000000000000000000000000000003",
          "tiers": [
            1,
            1
          ]
        }
      ]
    },
    {
      "window": 1101,
      "inputs": [
        {
          "type": "voidPurchase",
          "ref": "8815",
          "owner": "0xc0c0000000000000000000000000000000000003"
        }
      ]
    },
    {
      "window": 1102,
      "inputs": [
        {
          "type": "voidPurchase",
          "ref": "8815",
          "owner": "0xc0c0000000000000000000000000000000000003"
        },
        {
          "type": "purchase",
          "ref": "8815",
          "owner": "0xc0c0000000000000000000000000000000000003",
          "tiers": [
            0
          ]
        }
      ]
    },
    {
      "window": 1300,
      "blockHash": "0x0303030303030303030303030303030303030303030303030303030303030303",
      "inputs": [
        {
          "type": "purchase",
          "ref": "8817",
          "owner": "0xb0b0000000000000000000000000000000000002",
          "tiers": [
            0
          ]
        }
      ]
    },
    {
      "window": 1450,
      "inputs": [
        {
          "type": "purchase",
          "ref": "8820",
          "owner": "0xa11ce00000000000000000000000000000000001",
          "tiers": [
            2
          ]
        }
      ]
    },
    {
      "window": 1640,
      "inputs": [
        {
          "type": "purchase",
          "ref": "8821",
          "owner": "0xc0c0000000000000000000000000000000000003",
          "tiers": [
            2,
            1
          ]
        }
      ]
    },
    {
      "window": 1650,
      "blockHash": "0x0404040404040404040404040404040404040404040404040404040404040404",
      "inputs": [
        {
          "type": "freeze",
          "reason": "ROOM_CLOSED"
        }
      ]
    }
  ]
}
