{
  "schema": "pikit.inputlog/v0",
  "rulesHash": "0x85cd30d9c4ee92fe054f88cf96d4d623218a350ddee05ee589b7b3c6fcce775c",
  "chainId": 143,
  "shop": "0x5b0b000000000000000000000000000000000005",
  "roomId": 3,
  "seed": "0x0101010101010101010101010101010101010101010101010101010101010101",
  "firstWindow": 20000,
  "lastWindow": 20300,
  "windows": [
    {
      "window": 20001,
      "blockHash": "0x7070707070707070707070707070707070707070707070707070707070707070",
      "inputs": [
        {
          "type": "purchase",
          "ref": "7000",
          "owner": "0xd1a0000000000000000000000000000000000001",
          "tiers": [
            0,
            1,
            2
          ]
        },
        {
          "type": "purchase",
          "ref": "7001",
          "owner": "0xd1a0000000000000000000000000000000000002",
          "tiers": [
            0,
            1,
            2
          ]
        },
        {
          "type": "purchase",
          "ref": "7002",
          "owner": "0xd1a0000000000000000000000000000000000003",
          "tiers": [
            0,
            1,
            2
          ]
        }
      ]
    }
  ]
}
