{
  "schema": "pikit.inputlog/v0",
  "rulesHash": "0x169cc202d804674cf400a149045b57ebdcad213a254f603d6c6a25c4c3eb2c8f",
  "chainId": 143,
  "shop": "0x5b0b000000000000000000000000000000000005",
  "roomId": 2,
  "seed": "0x6262626262626262626262626262626262626262626262626262626262626262",
  "firstWindow": 5000,
  "lastWindow": 8000,
  "windows": [
    {
      "window": 5001,
      "blockHash": "0x1010101010101010101010101010101010101010101010101010101010101010",
      "inputs": [
        {
          "type": "purchase",
          "ref": "9000",
          "owner": "0xaaaa000000000000000000000000000000000001",
          "tiers": [
            0,
            1,
            2,
            3,
            4,
            0,
            1,
            2,
            3,
            4
          ]
        },
        {
          "type": "purchase",
          "ref": "9001",
          "owner": "0xbbbb000000000000000000000000000000000002",
          "tiers": [
            1,
            2,
            3,
            4,
            0,
            1,
            2,
            3,
            4,
            0
          ]
        },
        {
          "type": "purchase",
          "ref": "9002",
          "owner": "0xcccc000000000000000000000000000000000003",
          "tiers": [
            2,
            3,
            4,
            0,
            1,
            2,
            3,
            4,
            0,
            1
          ]
        },
        {
          "type": "purchase",
          "ref": "9003",
          "owner": "0xdddd000000000000000000000000000000000004",
          "tiers": [
            3,
            4,
            0,
            1,
            2,
            3,
            4,
            0,
            1,
            2
          ]
        },
        {
          "type": "purchase",
          "ref": "9004",
          "owner": "0xeeee000000000000000000000000000000000005",
          "tiers": [
            4,
            0,
            1,
            2,
            3,
            4,
            0,
            1,
            2,
            3
          ]
        },
        {
          "type": "purchase",
          "ref": "9005",
          "owner": "0xffff000000000000000000000000000000000006",
          "tiers": [
            0,
            1,
            2,
            3,
            4,
            0,
            1,
            2,
            3,
            4
          ]
        },
        {
          "type": "purchase",
          "ref": "9006",
          "owner": "0x7777000000000000000000000000000000000007",
          "tiers": [
            1,
            2,
            3,
            4,
            0,
            1,
            2,
            3,
            4,
            0
          ]
        }
      ]
    },
    {
      "window": 6000,
      "blockHash": "0x1111111111111111111111111111111111111111111111111111111111111111",
      "inputs": [
        {
          "type": "purchase",
          "ref": "9010",
          "owner": "0xaaaa000000000000000000000000000000000001",
          "tiers": [
            1,
            2,
            3,
            4,
            0,
            1,
            2,
            3,
            4,
            0
          ]
        },
        {
          "type": "purchase",
          "ref": "9011",
          "owner": "0xbbbb000000000000000000000000000000000002",
          "tiers": [
            2,
            3,
            4,
            0,
            1,
            2,
            3,
            4,
            0,
            1
          ]
        },
        {
          "type": "purchase",
          "ref": "9012",
          "owner": "0xcccc000000000000000000000000000000000003",
          "tiers": [
            3,
            4,
            0,
            1,
            2,
            3,
            4,
            0,
            1,
            2
          ]
        },
        {
          "type": "purchase",
          "ref": "9013",
          "owner": "0xdddd000000000000000000000000000000000004",
          "tiers": [
            4,
            0,
            1,
            2,
            3,
            4,
            0,
            1,
            2,
            3
          ]
        },
        {
          "type": "purchase",
          "ref": "9014",
          "owner": "0xeeee000000000000000000000000000000000005",
          "tiers": [
            0,
            1,
            2,
            3,
            4,
            0,
            1,
            2,
            3,
            4
          ]
        },
        {
          "type": "purchase",
          "ref": "9015",
          "owner": "0xffff000000000000000000000000000000000006",
          "tiers": [
            1,
            2,
            3,
            4,
            0,
            1,
            2,
            3,
            4,
            0
          ]
        },
        {
          "type": "purchase",
          "ref": "9016",
          "owner": "0x7777000000000000000000000000000000000007",
          "tiers": [
            2,
            3,
            4,
            0,
            1,
            2,
            3,
            4,
            0,
            1
          ]
        }
      ]
    },
    {
      "window": 7000,
      "blockHash": "0x1212121212121212121212121212121212121212121212121212121212121212",
      "inputs": [
        {
          "type": "purchase",
          "ref": "9020",
          "owner": "0xaaaa000000000000000000000000000000000001",
          "tiers": [
            2,
            3,
            4,
            0,
            1,
            2,
            3,
            4,
            0,
            1
          ]
        },
        {
          "type": "purchase",
          "ref": "9021",
          "owner": "0xbbbb000000000000000000000000000000000002",
          "tiers": [
            3,
            4,
            0,
            1,
            2,
            3,
            4,
            0,
            1,
            2
          ]
        },
        {
          "type": "purchase",
          "ref": "9022",
          "owner": "0xcccc000000000000000000000000000000000003",
          "tiers": [
            4,
            0,
            1,
            2,
            3,
            4,
            0,
            1,
            2,
            3
          ]
        },
        {
          "type": "purchase",
          "ref": "9023",
          "owner": "0xdddd000000000000000000000000000000000004",
          "tiers": [
            0,
            1,
            2,
            3,
            4,
            0,
            1,
            2,
            3,
            4
          ]
        },
        {
          "type": "purchase",
          "ref": "9024",
          "owner": "0xeeee000000000000000000000000000000000005",
          "tiers": [
            1,
            2,
            3,
            4,
            0,
            1,
            2,
            3,
            4,
            0
          ]
        },
        {
          "type": "purchase",
          "ref": "9025",
          "owner": "0xffff000000000000000000000000000000000006",
          "tiers": [
            2,
            3,
            4,
            0,
            1,
            2,
            3,
            4,
            0,
            1
          ]
        },
        {
          "type": "purchase",
          "ref": "9026",
          "owner": "0x7777000000000000000000000000000000000007",
          "tiers": [
            3,
            4,
            0,
            1,
            2,
            3,
            4,
            0,
            1,
            2
          ]
        }
      ]
    }
  ]
}
