{
  "schema": "pikit.inputlog/v0",
  "rulesHash": "0x94e506518098db135006fc73ff61fbb0c8170ac6f591f372a291e0f770a46e9f",
  "chainId": 143,
  "shop": "0x5b0b000000000000000000000000000000000005",
  "roomId": 4,
  "seed": "0x0202020202020202020202020202020202020202020202020202020202020202",
  "firstWindow": 30000,
  "lastWindow": 32000,
  "windows": [
    {
      "window": 30001,
      "blockHash": "0x4040404040404040404040404040404040404040404040404040404040404040",
      "inputs": [
        {
          "type": "purchase",
          "ref": "4000",
          "owner": "0x4a4a000000000000000000000000000000000001",
          "tiers": [
            0,
            1,
            2,
            0,
            1,
            2,
            0,
            1,
            2,
            0
          ]
        },
        {
          "type": "purchase",
          "ref": "4001",
          "owner": "0x4a4a000000000000000000000000000000000002",
          "tiers": [
            1,
            2,
            0,
            1,
            2,
            0,
            1,
            2,
            0,
            1
          ]
        },
        {
          "type": "purchase",
          "ref": "4002",
          "owner": "0x4a4a000000000000000000000000000000000003",
          "tiers": [
            2,
            0,
            1,
            2,
            0,
            1,
            2,
            0,
            1,
            2
          ]
        },
        {
          "type": "purchase",
          "ref": "4003",
          "owner": "0x4a4a000000000000000000000000000000000004",
          "tiers": [
            0,
            1,
            2,
            0,
            1,
            2,
            0,
            1,
            2,
            0
          ]
        },
        {
          "type": "purchase",
          "ref": "4004",
          "owner": "0x4a4a000000000000000000000000000000000005",
          "tiers": [
            1,
            2,
            0,
            1,
            2,
            0,
            1,
            2,
            0,
            1
          ]
        },
        {
          "type": "purchase",
          "ref": "4005",
          "owner": "0x4a4a000000000000000000000000000000000006",
          "tiers": [
            2,
            0,
            1,
            2,
            0,
            1,
            2,
            0,
            1,
            2
          ]
        },
        {
          "type": "purchase",
          "ref": "4006",
          "owner": "0x4a4a000000000000000000000000000000000007",
          "tiers": [
            0,
            1,
            2,
            0,
            1,
            2,
            0,
            1,
            2,
            0
          ]
        },
        {
          "type": "purchase",
          "ref": "4007",
          "owner": "0x4a4a000000000000000000000000000000000008",
          "tiers": [
            1,
            2,
            0,
            1,
            2,
            0,
            1,
            2,
            0,
            1
          ]
        }
      ]
    },
    {
      "window": 31000,
      "blockHash": "0x4141414141414141414141414141414141414141414141414141414141414141",
      "inputs": [
        {
          "type": "purchase",
          "ref": "4010",
          "owner": "0x4a4a000000000000000000000000000000000001",
          "tiers": [
            1,
            2,
            0,
            1,
            2,
            0,
            1,
            2,
            0,
            1
          ]
        },
        {
          "type": "purchase",
          "ref": "4011",
          "owner": "0x4a4a000000000000000000000000000000000002",
          "tiers": [
            2,
            0,
            1,
            2,
            0,
            1,
            2,
            0,
            1,
            2
          ]
        },
        {
          "type": "purchase",
          "ref": "4012",
          "owner": "0x4a4a000000000000000000000000000000000003",
          "tiers": [
            0,
            1,
            2,
            0,
            1,
            2,
            0,
            1,
            2,
            0
          ]
        },
        {
          "type": "purchase",
          "ref": "4013",
          "owner": "0x4a4a000000000000000000000000000000000004",
          "tiers": [
            1,
            2,
            0,
            1,
            2,
            0,
            1,
            2,
            0,
            1
          ]
        },
        {
          "type": "purchase",
          "ref": "4014",
          "owner": "0x4a4a000000000000000000000000000000000005",
          "tiers": [
            2,
            0,
            1,
            2,
            0,
            1,
            2,
            0,
            1,
            2
          ]
        },
        {
          "type": "purchase",
          "ref": "4015",
          "owner": "0x4a4a000000000000000000000000000000000006",
          "tiers": [
            0,
            1,
            2,
            0,
            1,
            2,
            0,
            1,
            2,
            0
          ]
        },
        {
          "type": "purchase",
          "ref": "4016",
          "owner": "0x4a4a000000000000000000000000000000000007",
          "tiers": [
            1,
            2,
            0,
            1,
            2,
            0,
            1,
            2,
            0,
            1
          ]
        },
        {
          "type": "purchase",
          "ref": "4017",
          "owner": "0x4a4a000000000000000000000000000000000008",
          "tiers": [
            2,
            0,
            1,
            2,
            0,
            1,
            2,
            0,
            1,
            2
          ]
        }
      ]
    }
  ]
}
